resourceId,resourceName,resourceType,observationText,observationType,observationPhase,observationTime,observationTimeUnits,doi
4a550816-e561-4d4b-a25c-995ea23b8a41,KP-3,['Cell Line'],The KP-3 cell line was established from a liver metastasis of pancreatic adenosquamous carcinoma from a 75-year-old Japanese man.,['Cell line origin'],,,,https://doi.org/10.1111/j.1349-7006.1990.tb03336.x
4a550816-e561-4d4b-a25c-995ea23b8a41,KP-3,['Cell Line'],The KP-3 cell line had a population doubling time of 28.8 hours during exponential growth phase.,['Growth rate'],,,,https://doi.org/10.1111/j.1349-7006.1990.tb03336.x
4a550816-e561-4d4b-a25c-995ea23b8a41,KP-3,['Cell Line'],The KP-3 cell line was tumorigenic and formed tumors resembling the original lesion when injected subcutaneously into nude mice.,['Tumorigenicity'],,,,https://doi.org/10.1111/j.1349-7006.1990.tb03336.x
4a550816-e561-4d4b-a25c-995ea23b8a41,KP-3,['Cell Line'],The KP-3 cell line produced liver metastases after intrasplenic injection into nude mice.,['Metastasis'],,,,https://doi.org/10.1111/j.1349-7006.1990.tb03336.x
4a550816-e561-4d4b-a25c-995ea23b8a41,KP-3,['Cell Line'],A highly metastatic subline KP-3Ls was isolated from liver colonies formed after intrasplenic injection of KP-3 cells into nude mice.,"['Subline derivation', 'Metastasis']",,,,https://doi.org/10.1111/j.1349-7006.1990.tb03336.x
4a550816-e561-4d4b-a25c-995ea23b8a41,KP-3,['Cell Line'],"The KP-3 cell line exhibited a modal chromosome number of 68 based on metaphase analysis, indicating an aneuploid karyotype with many abnormal chromosomes.",['Cytogenetics'],,,,https://doi.org/10.1111/j.1349-7006.1990.tb03336.x
4a550816-e561-4d4b-a25c-995ea23b8a41,KP-3,['Cell Line'],The KP-3 cell line produced and released the carbohydrate antigen 19-9 into the spent culture medium.,['Biochemical markers'],,,,https://doi.org/10.1111/j.1349-7006.1990.tb03336.x
