resourceId,resourceName,resourceType,observationText,observationType,observationPhase,observationTime,observationTimeUnits,doi
669641d6-2e7c-4679-bfe8-0d31c53c2dfc,Nf1flox/mut; NG2-Cre,['Animal Model'],"Analysis of the optic nerves from Nf1flox/mut; NG2-Cre mice revealed no evidence of optic glioma formation at 3 months of age, with only a slight increase in optic nerve volume but no changes in proliferation, microglia numbers, astrocyte numbers or NG2+ cell numbers compared to controls.","['Tumor incidence', 'Organ Development']",juvenile,3,months,https://doi.org/10.1038/onc.2012.580
669641d6-2e7c-4679-bfe8-0d31c53c2dfc,Nf1flox/mut; NG2-Cre,['Animal Model'],No optic gliomas were observed in a cohort of Nf1flox/mut; NG2-Cre mice at 6 months of age.,['Tumor incidence'],juvenile,6,months,https://doi.org/10.1038/onc.2012.580
669641d6-2e7c-4679-bfe8-0d31c53c2dfc,Nf1flox/mut; NG2-Cre,['Animal Model'],The failure of Nf1flox/mut; NG2-Cre mice to develop optic gliomas may reflect the requirement for a specific population of susceptible progenitor cells within the third ventricle germinal zone that are not targeted by NG2-Cre.,"['Tumor susceptibility', 'Issue']",,,,https://doi.org/10.1038/onc.2012.580
669641d6-2e7c-4679-bfe8-0d31c53c2dfc,Nf1flox/mut; NG2-Cre,['Animal Model'],"Nf1flox/mut; NG2-Cre mice exhibited Cre-mediated Nf1 gene recombination in the optic nerve, as demonstrated by recombination PCR.",['Genomics'],,,,https://doi.org/10.1038/onc.2012.580
669641d6-2e7c-4679-bfe8-0d31c53c2dfc,Nf1flox/mut; NG2-Cre,['Animal Model'],"The percentage of cells with Cre-mediated excision in the optic nerves of Nf1flox/mut; NG2-Cre mice was slightly higher than that observed in GFAP-Cre mice, as shown by crossing with Rosa-GREEN reporter mice.",['Genomics'],,,,https://doi.org/10.1038/onc.2012.580
669641d6-2e7c-4679-bfe8-0d31c53c2dfc,Nf1flox/mut; NG2-Cre,['Animal Model'],"Nf1flox/mut; NG2-Cre mouse optic nerves exhibited a 42% decrease in total Nf1 mRNA expression compared to wild-type mice, as measured by RNA fluorescence in situ hybridization (FISH).",['Genomics'],,,,https://doi.org/10.1038/onc.2012.580
669641d6-2e7c-4679-bfe8-0d31c53c2dfc,Nf1flox/mut; NG2-Cre,['Animal Model'],"Optic nerves from Nf1flox/mut; NG2-Cre mice showed a 30% reduction in the percentage of GFAP/neurofibromin double-positive cells compared to controls, with no change in the percentage of NG2/neurofibromin double-positive cells.",['Protein expression'],,,,https://doi.org/10.1038/onc.2012.580
669641d6-2e7c-4679-bfe8-0d31c53c2dfc,Nf1flox/mut; NG2-Cre,['Animal Model'],"Nf1flox/mut; NG2-Cre mice were healthy and bred successfully, in contrast to the optic glioma phenotype observed in Nf1flox/mut; GFAP-Cre mice.",['Reproductive Behavior'],,,,https://doi.org/10.1038/onc.2012.580
